<?xml version="1.0" encoding="UTF-8"?>
<xs:schema xmlns:xs="http://www.w3.org/2001/XMLSchema"
	elementFormDefault="qualified">
	<xs:element name="students">
		<xs:complexType>
			<xs:sequence>
				<xs:element name="student" minOccurs="0"
					maxOccurs="unbounded">
					<xs:complexType>
						<xs:sequence>
							<xs:element name="idno" type="xs:string" />
							<xs:element name="name" type="xs:string" />
							<xs:element name="marks" type="xs:byte" />
							<xs:element name="email" type="xs:string" />
							<xs:element name="class" type="xs:string" />
						</xs:sequence>
					</xs:complexType>
				</xs:element>
			</xs:sequence>
		</xs:complexType>
	</xs:element>
</xs:schema>